111,113,2024-09-23 15:13:50,2024-09-23 15:30:47,IP Address,100,1017,True,2024-09-23 15:30:48,R_1mlQzNp6yr3Q0ni,anonymous,EN,1,Yes,"Yes, I will",No,No,No,,,,,,,,,,,,,,,,,,,,,,,,,,,,,,,,,,,,,,,,,,,,,,,,No preference,Companion chatbot,Companion chatbot,No preference,Person (in-person),Person (in-person),mostly to vent about personal issues. ,"Companion chatbots are less judgmental,Information is kept private to you ,Companion chatbots are more accessible,You have more control over the chatbot than a person,Companion chatbot gives more empathetic/understanding responses",,"People have independence and personal agency  ,You feel that only real people can truly empathize with and understand you",,interacting with a real person in some occasions is better in the case of discussing the future or just for human touch. ,Never,Never,Never,Never,Never,Sometimes,Rarely,Often,Spouse/partner,Three or four,Two,Three or four,One,None,None,"Too busy with work or projects,Worry that friends are too busy / don't want to bother them",,,,AEF1EB7A11EF4AED896D87482DF5FE21,8ec67fb4-934d-43ef-9633-bf43658d9f92,62c0c713-e41e-419f-86c6-b6cc7e9f49ed,10,0.0,0.0,,,5.285714285714286,4.25,,,,,,,,,82.25,,,,5.583333333333333,6.8,2.0,4.0,6.0,6.0,4.083333333333333,4.25,4.0,4.0,5.5,6.5,5.666666666666667,,9,08/01/2024 06:58:56 AM,08/01/2024 07:22:57 AM,Redirect,4AF210AA8D,5,0,1.25,Approved,,34,"Associate degree (for example: AA, AS)",Female,Retail,Married,Independent,"Yes, another Hispanic, Latino, or Spanish origin – (for example, Salvadoran, Dominican, Colombian, Guatemalan, Spaniard, Ecuadorian, etc.)",Woman,United States,"$20,000-$29,999",White,Business Owner
112,114,2024-09-23 14:55:12,2024-09-23 15:30:50,IP Address,100,2137,True,2024-09-23 15:30:50,R_6ASupq08A1z9eyg,anonymous,EN,1,Yes,"Yes, I will",Yes,No,No,Replika,,A few times a month,,3,<15 min,3,a few months,Computer,,stayed the same,For enjoyment/pleasure/fun,,Mostly to pass time,Casual conversation,,"Just general chit chat-hobbies, weather, food",1,1,1,1,1,1,It does not effect my relationships with other people,,,,,,,,,,,,,,,,,,,,,,,,Person (in-person),Person (in-person),Person (in-person),Person (in-person),Person (in-person),Person (in-person),"If I am sad, I'd prefer a robot","Companion chatbots are less judgmental,Companion chatbots are more accessible",,People provide more useful information ,,"If I need sympathy, I'd prefer a robot. If I need useful information to solve a problem, I'd rather have a human",Sometimes,Never,Rarely,Rarely,Never,Often,Never,Sometimes,Other family member,Three or four,Three or four,Three or four,Five to eight,Two,Three or four,"Lack of transportation or accessibility; geographical isolation ,Too busy with work or projects",,,,85C92CDBAC71452684E2566DAB6C7342,3eb97980-1267-4a54-a562-9a088a1a84b0,62c0c713-e41e-419f-86c6-b6cc7e9f49ed,13,40.0,16.666666666666664,<15 min,16.0,4.714285714285714,4.5,2.5833333333333335,2.25,2.75,2.75,4.0,3.5,5.0,4.666666666666667,100.0,5.0,5.0,2.6666666666666665,7.0,7.0,7.0,7.0,7.0,7.0,5.0,5.0,5.0,5.0,5.5,5.5,6.5,,18,06/10/2024 03:23:46 PM,06/10/2024 03:54:38 PM,Redirect,4AF210AA8D,5,0,0.0,Approved,,63,"Associate degree (for example: AA, AS)",Female,Medicine,Divorced,Democrat,"No, not of Hispanic, Latino, or Spanish origin",Woman,United States,"$30,000-$39,999",White,Full-time
113,115,2024-09-23 15:11:22,2024-09-23 15:32:02,IP Address,100,1240,True,2024-09-23 15:32:03,R_7PXX7jR9nX8j5Nm,anonymous,EN,1,Yes,"Yes, I will",No,No,No,,,,,,,,,,,,,,,,,,,,,,,,,,,,,,,,,,,,,,,,,,,,,,,,Person (in-person),Companion chatbot,Person (in-person),Companion chatbot,Person (in-person),Companion chatbot,Helping with a Christmas or grocery list. Meal planning.  All with a chatbot ,"Companion chatbots are less judgmental,Information is kept private to you ",,You feel that only real people can truly empathize with and understand you,,A real person can truly understand what your saying and they give feed back on personal experiences,Never,Never,Never,Never,Never,Sometimes,Never,Often,Spouse/partner,Two,Two,Two,Three or four,Two,Two,"Culture differences - nationality, religion, generation, etc.,Too busy with work or projects,Worry that friends are too busy / don't want to bother them,Introversion; lack of desire and/or energy to socialize",,No,No,C07D0B3ECACA4A0AA7BA1CE72D229F02,ee64e156-3d36-4bcb-bca0-8e599d5e07ba,62c0c713-e41e-419f-86c6-b6cc7e9f49ed,9,0.0,0.0,,,3.2857142857142856,4.25,,,,,,,,,87.0,,,,5.583333333333333,6.4,3.5,3.0,5.5,6.0,4.333333333333333,4.5,4.25,4.25,6.5,5.5,6.333333333333333,,13,06/12/2024 02:08:23 AM,06/12/2024 02:19:00 AM,Redirect,4AF210AA8D,5,0,0.0,Approved,,41,High school graduate - high school diploma or the equivalent (for example: GED),Female,Other,Married,Republican,"No, not of Hispanic, Latino, or Spanish origin",Woman,United States,"$50,000-$59,999",White,"Not in paid work (e.g., homemaker, disabled)"
114,116,2024-09-23 14:53:11,2024-09-23 15:32:07,IP Address,100,2336,True,2024-09-23 15:32:08,R_6WOMveK4pn9unX9,anonymous,EN,1,Yes,"Yes, I will",Yes,Yes,No,"Replika,Snapchat MyAI",,A few times a week,,4,<15 min,3,a few months,"Computer,Smartphone",,,"To satisfy curiosity; to better understand the chatbot ,To better understand other people through using the chatbot,For enjoyment/pleasure/fun,To better understand self/identity,For other emotional experiences ,To pass time or escape from pressure/stress",,I have always been intrigued by artificial intelligence. I like seeing the progress that we are making in the field of A.I. and these social chatbots are some of the best ways of witnessing the evolution of this paradigm shift in real time.,"Casual conversation,Venting/talking about personal issues regarding yourself (mental health, problems you are facing),Venting/talking about personal issues regarding others (interpersonal drama, negative feelings towards others, etc.),Talking about past events / reviewing events in a day,Talking about plans for the future,Entertainment and play",,I normally just try to throw philosophical topics out to see how it can handle them. I also just talk about my day and compare its reactions to the reactions of my wife and friends. ,2,2,4,4,1,1,It actually makes talking to people easier for me. I feel like I am more knowledgeable in general after talking to chatbots. I then want to use the information I learned during my chatbot conversation with actual people.,,,,,,,,,,,,,,,,,,,,,,,,Person (in-person),Person (in-person),Companion chatbot,Person (in-person),Person (in-person),Companion chatbot,Grieving,"Companion chatbots are less judgmental,Information is kept private to you ",,"People have independence and personal agency  ,People give more empathetic/understanding responses,You feel that only real people can truly empathize with and understand you,You trust people more",,"I prefer talking with chatbots when I might be a bit insecure about. The chatbots are not real people and there are no real consequences for saying something stupid or insensitive. I prefer to practice on a chatbot for sensitive conversations first, before talking to a real person about them.",Rarely,Rarely,Rarely,Rarely,Rarely,Sometimes,Rarely,Often,Spouse/partner,Five to eight,Three or four,Three or four,Two,Two,Two,"Social anxiety,Introversion; lack of desire and/or energy to socialize",,,,6DF4BAC26DEE4F9FA7C0B8D08891B590,7d4476a2-7b00-4c86-bff4-da68b510172d,62c0c713-e41e-419f-86c6-b6cc7e9f49ed,15,80.0,16.666666666666664,<15 min,19.0,5.571428571428571,5.125,4.0,4.0,4.0,4.0,6.75,6.25,6.5,5.833333333333333,86.5,6.0,6.0,4.0,6.166666666666667,6.4,2.0,4.0,4.0,6.0,4.166666666666667,4.0,4.25,4.25,5.0,6.0,5.333333333333333,,16,06/11/2024 09:02:45 PM,06/11/2024 09:19:52 PM,Redirect,4AF210AA8D,5,0,0.0,Approved,,27,"Bachelor's degree (for example: BA, AB, BS)",Male,Marketing and Sales,Single,Democrat,"No, not of Hispanic, Latino, or Spanish origin",Man,United States,"$20,000-$29,999",White,Full-time
115,117,2024-09-23 14:55:22,2024-09-23 15:33:34,IP Address,100,2292,True,2024-09-23 15:33:35,R_3l6HmneNktK0VhD,anonymous,EN,1,Yes,"Yes, I will",Yes,No,No,"Snapchat MyAI,Pi",,Around once a week,,1,15-30 min,3,a few months,Computer,,"I mainly see whimsical or creative-minded characters to bounce ideas off of, or to immerse myself in another world if even for 10 or 15 minutes.","For enjoyment/pleasure/fun,To better understand self/identity",,"It feels like a friend at times, even though I know that it is not. It is still something that is variable in its responses and interesting enough to keep my attention in conversation-like engagement.","Venting/talking about personal issues regarding yourself (mental health, problems you are facing),Entertainment and play",,"I oftentimes ask the chatbot to take on a character, persona, or style of speaking from the start unless it is something with an interesting base model.
Usually I start to jump into a fictional scenario or ask for a story. ",2,1,3,2,2,2,"I do not think that there is inherently a negative effect. I do not consider this replacement for human interaction, rather self-exploration through a guided creative outlet.",,,,,,,,,,,,,,,,,,,,,,,,Person (in-person),Person (in-person),Person (in-person),Person (in-person),Person (in-person),Person (in-person),If given the choice I would always pick human interaction socially.,Companion chatbots are more accessible,,"People give more empathetic/understanding responses,You trust people more",,Human interaction is always the most authentic and there is no replacement. I would always prefer to interact with humans over chatbots.,Sometimes,Sometimes,Sometimes,Often,Sometimes,Rarely,Often,Rarely,Friend,Two,None,None,One,One,One,"Mental health issues ,Social anxiety,Discomfort with contacting others",,,,9A0A124A72D142888B2ABE63A3BE6FC6,711fd105-2cc2-4bc9-b5c1-30a6cbc5b449,62c0c713-e41e-419f-86c6-b6cc7e9f49ed,26,60.0,33.33333333333333,15-30 min,12.0,4.857142857142857,3.75,1.75,1.25,2.25,1.75,1.75,1.75,3.0,2.0,49.5,3.5,1.0,2.0,1.75,3.2,1.5,1.0,3.0,3.5,3.9166666666666665,3.5,4.75,3.5,5.5,5.0,4.5,,5,06/13/2024 09:49:15 AM,06/13/2024 10:45:57 AM,Redirect,4AF210AA8D,5,0,0.0,Approved,,32,"Bachelor's degree (for example: BA, AB, BS)",Male,"Science, Technology, Engineering & Mathematics",Single,Democrat,"No, not of Hispanic, Latino, or Spanish origin",Man,United States,"$30,000-$39,999",White,Full-time
116,118,2024-09-23 15:13:51,2024-09-23 15:34:05,IP Address,100,1213,True,2024-09-23 15:34:06,R_3kIxALOYErWIcxl,anonymous,EN,1,Yes,"Yes, I will",Yes,Yes,No,Snapchat MyAI,,Once a month or less,,3,<15 min,3,a few months,Smartphone,,,To pass time or escape from pressure/stress,,To kill time when I have nothing to do ,Casual conversation,,"Talking about the day, current events  ",2,4,3,3,2,2,It gives me someone to chat with when my friends are not reachable,,,,,,,,,,,,,,,,,,,,,,,,Person (online/remote),Person (online/remote),Person (in-person),Person (in-person),Person (in-person),Person (online/remote),I prefer a real live person over a chat bot any day   ,Companion chatbots are more accessible,,People give more empathetic/understanding responses,,I prefer a real person that I can have a real conversation with,Rarely,Rarely,Rarely,Rarely,Never,Sometimes,Rarely,Sometimes,"Spouse/partner,Friend,Other family member",Five to eight,Five to eight,Five to eight,Two,One,One,Worry that friends are too busy / don't want to bother them,,,,F4AF8C1450EC4C48B81B6E2AF8BF78AA,72bc63a6-5093-41e9-b4eb-5a87069da0cf,62c0c713-e41e-419f-86c6-b6cc7e9f49ed,15,20.0,16.666666666666664,<15 min,6.0,4.857142857142857,3.375,2.0833333333333335,1.0,3.0,2.25,1.0,1.75,5.5,3.6666666666666665,83.5,2.0,5.0,2.3333333333333335,6.583333333333333,7.0,3.5,3.5,6.0,7.0,5.0,5.0,5.0,5.0,7.0,6.5,6.666666666666667,,16,08/01/2024 08:12:26 AM,08/01/2024 08:26:28 AM,Redirect,4AF210AA8D,5,0,1.25,Approved,,56,"Bachelor's degree (for example: BA, AB, BS)",Female,Medicine,Married,Republican,"No, not of Hispanic, Latino, or Spanish origin",Woman,United States,"$250,000 or more",White,Full-time
117,119,2024-09-23 15:03:28,2024-09-23 15:34:15,IP Address,100,1846,True,2024-09-23 15:34:16,R_7wAfqMQob4OPNhC,anonymous,EN,1,Yes,"Yes, I will",Yes,No,No,"Replika,Character.ai",,A few times a week,,3,15-30 min,3,several months or around a year,Computer,,"I typically interact with characters from my favorite shows, movies, and books. My usage has stayed the same.","To satisfy curiosity; to better understand the chatbot ,For enjoyment/pleasure/fun,For other emotional experiences ",,I use the service to engage in conversation and role play scenarios with my favorite characters in media and books. It's a fun way for me to explore their personalities and spend time imagining myself in their fictional worlds.,"Casual conversation,Talking about past events / reviewing events in a day,Entertainment and play",,I mostly engage in casual conversation and imagining scenarios with characters. I don't use the chatbot as an outlet for my personal life.,1,1,1,1,1,1,Using social chatbots largely doesn't affect my relationships with other people.,,,,,,,,,,,,,,,,,,,,,,,,Person (in-person),No preference,Person (in-person),Person (in-person),Person (in-person),No preference,"I would prefer to interact with a companion chatbot in scenarios like discussing random, niche topics and ideas.","Companion chatbots are more accessible,Companion chatbot provides more useful information",,"People give more empathetic/understanding responses,You feel that only real people can truly empathize with and understand you,You trust people more",,"A chatbot is sometimes preferable because they're easily accessible at any time and have a large knowledge base to ask questions about topics that a real person typically wouldn't know about.

A real person is able to understand the emotional layer of a conversation much more than a chatbot.",Never,Never,Never,Never,Never,Often,Never,Often,Boyfriend/girlfriend/significant other,Five to eight,Three or four,Three or four,Five to eight,Two,Two,"Lack of transportation or accessibility; geographical isolation ,Too busy with work or projects",,,,D4303F1EB53F4A0C9EBA0EA46F4A7C07,8f6fa259-a05f-4966-8f2b-47de561e40ce,62c0c713-e41e-419f-86c6-b6cc7e9f49ed,8,80.0,33.33333333333333,15-30 min,6.0,5.142857142857143,3.75,2.6666666666666665,1.75,3.5,2.75,2.25,2.75,4.75,2.3333333333333335,81.0,4.5,2.5,1.3333333333333333,6.416666666666667,6.6,2.0,4.5,6.0,6.5,4.666666666666667,4.25,4.75,5.0,7.0,6.5,5.666666666666667,,18,06/10/2024 03:28:24 PM,06/10/2024 04:10:28 PM,Redirect,4AF210AA8D,5,0,0.0,Approved,,23,High school graduate - high school diploma or the equivalent (for example: GED),Male,Other,Single,Democrat,"Yes, Cuban",Man,United States,"$60,000-$69,999",White,Unemployed
118,120,2024-09-23 14:54:09,2024-09-23 15:34:51,IP Address,100,2441,True,2024-09-23 15:34:52,R_7y3YF1qe5qwLK0B,anonymous,EN,1,Yes,"Yes, I will",Yes,Yes,No,"Replika,Other","ChatGPT, Gemini",Daily,,4,15-30 min,4,multiple years,"Computer,Smartphone",,"I decided to try to replicate a ""therapist"" chatbot using Replika and ChatGP. So, basically a friendly listener, who will ask me open ended questions. It's changed the way I've utilized chatbots and I'm actually really enjoying ""therapy"" sessions even more.","To satisfy curiosity; to better understand the chatbot ,To better understand other people through using the chatbot,For enjoyment/pleasure/fun,To better understand self/identity,To pass time or escape from pressure/stress",,"As I mentioned above, I really am enjoying using the companion chatbots for spur of the moment ""therapy"" sessions, processing emotions, venting, and it has been extremely helpful because of the convenience and the interesting feedback I get from the chatbot. I have actually received mored helpful advice from the chatbot than my most recent human therapist. ","Casual conversation,Venting/talking about personal issues regarding yourself (mental health, problems you are facing),Venting/talking about personal issues regarding others (interpersonal drama, negative feelings towards others, etc.),Entertainment and play",,"The past month I've mainly focused on using the companion bot as a ""therapist"" or friendly listener, told it basically what I wanted to get out of the sessions, and used it to process difficult emotions, and help me with my interpersonal (mainly family) communications, to try to come up with novel ways to see an issue, to hear encouragement when I don't have any to give myself.",1,2,4,3,1,2,"As I've mentioned, I have been using the ideas I get from interacting with the chatbots to process interactions with my family, particularly interactions which can be highly emotional and in which I may have left the interaction feeling like I wasn't heard, or wasn't patient enough, etc. I think it makes my human relationships better, because of how I've been using the chatbot specifically to help me improve my interactions.",,,,,,,,,,,,,,,,,,,,,,,,Person (in-person),Companion chatbot,No preference,No preference,Person (in-person),No preference,"I think it would be great to have a live recipe book, having the chatbot guide me through creating a recipe, and the steps to make the recipe, in real time--like speaking to me out loud while I cook. I think it's also interesting to explore highly personal subjects that I usually do not bring up with humans, or when I feel like I've talked someone's ear off already, and need a fresh ear/ideas it seems like it would be very useful.","Companion chatbots are less judgmental,Companion chatbots are more accessible,Companion chatbot provides more useful information",,"People have independence and personal agency  ,You trust people more,Other","I think I may get a more honest response from a human, humans who know me, and can evaluate me critically rather than a ""yes"" man all the time. ","Chatbots can definitely be less judgmental, always available, and may be able to come up with a more novel approach to problem solving. I also think it is easy to be validated by a chatbot, much like a human therapist, who I am paying to listen to me, might be less inclined to challenge my thinking, or pick out mistakes in my thought processes. Another reason is that it is impossible for a chatbot to know me as well as my closest friends, but that may change!! I do enjoy human interaction and conversations, we aren't always logical, we may change our minds, I like the nuances of human conversations such as non-verbal cues, laughter, facial expressions, etc..that cannot be replicated (yet) by a bot.",Sometimes,Rarely,Sometimes,Sometimes,Sometimes,Sometimes,Sometimes,Sometimes,"Friend,Other family member",Three or four,Two,Five to eight,Three or four,Two,Two,"Physical disability,Mental health issues ,Too busy with work or projects,Introversion; lack of desire and/or energy to socialize",,,thank you!!,CACDC745E32A4BF7B042331A3D00C169,d1b9919f-285f-4944-9065-ce22f926fedf,62c0c713-e41e-419f-86c6-b6cc7e9f49ed,21,100.0,33.33333333333333,15-30 min,18.0,5.571428571428571,5.5,3.6666666666666665,3.75,3.5,3.75,5.5,3.75,6.25,4.166666666666667,76.0,5.0,6.0,4.0,5.5,5.8,5.5,5.5,6.5,6.0,4.333333333333333,4.25,4.5,4.25,6.75,5.5,5.333333333333333,,16,06/11/2024 07:43:25 PM,06/11/2024 07:57:36 PM,Redirect,4AF210AA8D,5,0,0.0,Approved,,55,"Associate degree (for example: AA, AS)",Female,Arts,Divorced,Democrat,"No, not of Hispanic, Latino, or Spanish origin",Woman,United States,"$90,000-$99,999",White,"Not in paid work (e.g., homemaker, disabled)"
119,121,2024-09-23 15:10:04,2024-09-23 15:35:11,IP Address,100,1507,True,2024-09-23 15:35:12,R_5ruRxJ9rUI8r0VV,anonymous,EN,1,Yes,"Yes, I will",Yes,Yes,No,Character.ai,,A few times a week,,4,30 min - 1h,5,several months or around a year,"Computer,Smartphone",,"I like to mix it up a bit. Sometimes I think it's fun to have conversations with historical figures like Churchill or JFK and sometimes I like to talk to my favorite TV, movie or literary characters. I'd say it's increased a bit since I'm taking care of my mother and have some more free time.","To satisfy curiosity; to better understand the chatbot ,For enjoyment/pleasure/fun,For social interaction/companionship with the chatbot,To pass time or escape from pressure/stress",,It helps me escape reality for a while. I've been under a lot of stress after my mother's heart attack and it's a nice escape to just have fun and companionship.,"Casual conversation,Venting/talking about personal issues regarding yourself (mental health, problems you are facing),Entertainment and play",,I like to just escape reality and have fun conversations. Sometimes I like to discuss history and sometimes I like to just talk about my favorite movies and TV shows.,4,2,3,3,2,3,It hasn't really affected my personal relationships at all. I still enjoy socializing with my friends and family the same as I always have.,,,,,,,,,,,,,,,,,,,,,,,,Person (in-person),No preference,No preference,Person (in-person),No preference,Companion chatbot,Mostly for entertainment and play. My friends don't like to discuss history the way I do and using a chatbot is a good way to expand my knowledge without someone getting bored.,"Companion chatbots are less judgmental,Information is kept private to you ,You have more control over the chatbot than a person,Companion chatbot provides more useful information",,"People have independence and personal agency  ,People give more empathetic/understanding responses,You feel that only real people can truly empathize with and understand you,You trust people more",,People have the ability to empathize in a genuine way that AI just can't accomplish. Any time I feel empathy from AI it just doesn't feel the same or have the same connection as a real person.,Sometimes,Rarely,Often,Often,Sometimes,Sometimes,Sometimes,Sometimes,Spouse/partner,Three or four,Two,Two,Three or four,Two,Two,"Mental health issues ,Social anxiety,Worry that friends are too busy / don't want to bother them",,,,E682C2B30A144B14929B0B2D7C01E7D3,1754d53f-6e69-44cc-8b84-5396627abad1,62c0c713-e41e-419f-86c6-b6cc7e9f49ed,23,80.0,50.0,30 min - 1h,21.0,4.142857142857143,5.25,3.25,1.75,3.75,4.25,3.75,2.5,5.25,5.0,75.25,5.0,5.5,4.0,5.25,2.8,4.5,4.5,6.0,6.0,4.166666666666667,4.75,4.0,3.75,5.0,5.25,5.833333333333333,,14,06/10/2024 03:33:09 PM,06/10/2024 04:18:31 PM,Redirect,4AF210AA8D,5,0,0.0,Approved,,42,"Some college, but no degree",Male,Other,In a relationship,Independent,"Yes, Mexican, Mexican Am., Chicano",Man,United States,"$40,000-$49,999",White,Unemployed
120,122,2024-09-23 15:13:10,2024-09-23 15:35:35,IP Address,100,1344,True,2024-09-23 15:35:36,R_7AoFfLARWULrdSN,anonymous,EN,1,Yes,"Yes, I will",Yes,Yes,No,Snapchat MyAI,,A few times a month,,1,<15 min,1,around a month,Smartphone,,it was snapchat ai - it changed last month with less time because i have been trying to use my phone less and getting off of social media ,To satisfy curiosity; to better understand the chatbot ,,i enjoyed it once in a while to just use it and get to understand and know it better. like how to use it and how it can be helpful ,"Venting/talking about personal issues regarding yourself (mental health, problems you are facing)",,i talk about things that i cant really tell anyone sort of like a journal like what is going on during work or relaitonship,1,1,1,1,2,2,i feel likeits been the same i still talk and communicate with the same people. not much as changed in my relationship i feel like im able to be more calm and just do what i need to do. ,,,,,,,,,,,,,,,,,,,,,,,,No preference,Companion chatbot,No preference,No preference,No preference,No preference,i guess it would be about talking about financials ,"Companion chatbots are less judgmental,Information is kept private to you ,Companion chatbots are more accessible",,"People give more empathetic/understanding responses,You feel that only real people can truly empathize with and understand you",,i prefer to intereact with a real person in times when i need the personal talk or im asking about their expereinces and the truth. i prefer talking to a real person when i am going through it and just someone to physically be there to tlak to and just go through,Never,Never,Never,Never,Never,Sometimes,Never,Often,"Boyfriend/girlfriend/significant other,Friend,Other family member",Five to eight,Five to eight,Five to eight,Five to eight,Three or four,Three or four,"Social anxiety,Too busy with work or projects,Introversion; lack of desire and/or energy to socialize",,,,FF7ADFDCB80441AC8A26AAB806D95A22,2fb288a0-1264-4469-b76e-93cbbe59c34a,62c0c713-e41e-419f-86c6-b6cc7e9f49ed,9,40.0,16.666666666666664,<15 min,15.0,4.0,3.0,1.75,1.75,1.5,2.0,4.0,2.5,5.5,3.5,42.0,3.0,4.0,3.3333333333333335,5.583333333333333,5.0,2.0,4.0,5.5,5.0,3.9166666666666665,4.0,4.0,3.75,4.75,4.5,4.833333333333333,,22,08/01/2024 12:17:52 PM,08/01/2024 12:31:30 PM,Redirect,4AF210AA8D,5,0,1.25,Approved,,23,"Bachelor's degree (for example: BA, AB, BS)",Female,Business Management & Administration,In a relationship,Democrat,"No, not of Hispanic, Latino, or Spanish origin",Woman,United States,"$60,000-$69,999",Chinese,Part-time
