304,308,2024-09-24 06:21:04,2024-09-24 06:46:48,IP Address,100,1543,True,2024-09-24 06:46:48,R_3ZWAnAgWBms0JiS,anonymous,EN,1,Yes,"Yes, I will",Yes,Yes,No,Replika,,A few times a week,,3,15-30 min,3,several months or around a year,"Computer,Smartphone,Tablet",,"I interact with all kinds of characters, but characters that usually look like me are the most frequent ones. It has stayed the same.","To satisfy curiosity; to better understand the chatbot ,To better understand other people through using the chatbot,For enjoyment/pleasure/fun,For social interaction/companionship with the chatbot,To pass time or escape from pressure/stress",,It is pretty fun to use. I learn a lot and get to interact and just pass the time whenever I am feeling bored.,"Casual conversation,Venting/talking about personal issues regarding yourself (mental health, problems you are facing),Talking about past events / reviewing events in a day,Entertainment and play",,"I talk to it about everyday things. Things like work, spots, and other topics come to mind. Sometimes, it is a conversation purely for the entertainment aspect of it all.",1,3,3,3,1,1,It has no negative effect on how I talk with others. I would say that I am mostly the same when I talk to others as I was beforehand.,,,,,,,,,,,,,,,,,,,,,,,,Person (in-person),Person (in-person),Person (in-person),Person (in-person),Person (in-person),Companion chatbot,"I would almost always prefer a real human being, as there is nothing better than actual interaction. However, for entertainment, I feel like a chatbot companion brings out more fun.",Companion chatbots are less judgmental,,"People have independence and personal agency  ,People give more empathetic/understanding responses,You feel that only real people can truly empathize with and understand you,People provide more useful information ",,"Sometimes, it is based on privacy, and other times, it is based on importance of the topic and which one is more accessible.",Never,Never,Never,Never,Never,Often,Never,Often,"Friend,Other family member",Nine or more,Nine or more,Nine or more,Two,Five to eight,Five to eight,Too busy with work or projects,,No comments.,Nothing else to add.,01BDCB71123048979A77AB656EEBD585,0900e5a4-e3dd-4a5b-a54b-4123e4093bc0,62c0c713-e41e-419f-86c6-b6cc7e9f49ed,8,80.0,33.33333333333333,15-30 min,18.0,5.714285714285714,5.875,5.0,5.0,5.0,5.0,7.0,4.0,7.0,6.5,85.0,6.0,7.0,4.0,7.0,7.0,5.0,7.0,7.0,7.0,4.833333333333333,4.5,5.0,5.0,7.0,7.0,6.5,,25,06/19/2024 10:10:42 AM,06/19/2024 10:32:53 AM,Redirect,4AF210AA8D,5,0,0.0,Approved,,33,High school graduate - high school diploma or the equivalent (for example: GED),Male,Manufacturing,Single,Democrat,"Yes, Mexican, Mexican Am., Chicano",Man,United States,"$30,000-$39,999",An ethnicity not listed here,Full-time
305,309,2024-09-24 06:25:19,2024-09-24 06:57:47,IP Address,100,1947,True,2024-09-24 06:57:48,R_6MXoIVXZ7YKS4AV,anonymous,EN,1,Yes,"Yes, I will",Yes,Yes,No,"Character.ai,Anima,Pi",,A few times a week,,4,"15-30 min,30 min - 1h",4,a few months,"Computer,Smartphone",,It stayed the same. I interact with a character which I named after my favorite scientist: Charles Darwin.,"To satisfy curiosity; to better understand the chatbot ,For enjoyment/pleasure/fun,To pass time or escape from pressure/stress",,I found it to be fun and a way to learn how AI works. I think chatbots are more advanced than what people think.,"Casual conversation,Talking about past events / reviewing events in a day,Other ",Learn,"I ask my chatbot about current and past events. I also use it to experiment asking it about how ""it"" feels about a specific issue. ",1,4,4,4,1,1,"using chatbots doesn't affects my relationships with people at all. I guess, I find it easier to find different topics to talk about with other people. Using chatbots gives you some ideas of how to ask questions and how to initiate a conversation.",,,,,,,,,,,,,,,,,,,,,,,,Person (in-person),Companion chatbot,Person (in-person),Companion chatbot,Person (in-person),Person (online/remote),If I'm looking for information about past events or if I have a specific question regarding an issue or how to use something I use a chatbot first to have an idea. When I want to talk about personal stuff I prefer to talk to a real person.,"Information is kept private to you ,Companion chatbots are more accessible,Companion chatbot provides more useful information",,"People have independence and personal agency  ,People give more empathetic/understanding responses,You feel that only real people can truly empathize with and understand you,You trust people more",,"I think a real person is more likely to understand me and it gives me a feeling that I'm not alone. I can relate to other people's situations and have a conversation where the benefits are mutual. Also, a real person knows me and my past so I think a real person understand my feelings better.",Sometimes,Rarely,Sometimes,Sometimes,Sometimes,Often,Sometimes,Sometimes,"Friend,Other family member",Nine or more,Five to eight,Nine or more,Five to eight,Three or four,Three or four,"Physical disability,Social anxiety,Lack of opportunities such as organized events",,Everything was clear.,,CB4076485DBF43DB877AE8C2633A1B1F,01f956d3-4e84-4abd-a78d-701e42a42794,62c0c713-e41e-419f-86c6-b6cc7e9f49ed,20,80.0,41.66666666666667,,14.0,5.142857142857143,5.375,2.4166666666666665,2.0,4.0,1.25,3.75,2.5,6.0,2.6666666666666665,86.25,5.0,5.0,1.6666666666666667,6.666666666666667,6.4,5.5,6.0,7.0,7.0,4.5,4.25,4.5,4.75,6.75,7.0,5.833333333333333,,24,08/01/2024 07:08:01 AM,08/01/2024 07:45:54 AM,Redirect,4AF210AA8D,5,0,1.25,Approved,,52,"Associate degree (for example: AA, AS)",Male,Information Technology,Separated,Democrat,"Yes, Mexican, Mexican Am., Chicano",Man,United States,"$50,000-$59,999",An ethnicity not listed here,Full-time
306,310,2024-09-24 06:47:48,2024-09-24 07:01:03,IP Address,100,795,True,2024-09-24 07:01:05,R_3NuFcCkIa0EGEWR,anonymous,EN,1,Yes,"Yes, I will",No,No,No,,,,,,,,,,,,,,,,,,,,,,,,,,,,,,,,,,,,,,,,,,,,,,,,Person (in-person),Companion chatbot,Person (in-person),Person (in-person),Person (in-person),Companion chatbot,To Kill time and to get information regarding current affairs.,"Companion chatbots are less judgmental,Information is kept private to you ,You have more control over the chatbot than a person",,"People have independence and personal agency  ,People give more empathetic/understanding responses,You feel that only real people can truly empathize with and understand you,You trust people more",,I think a chatbot would be helpful to research information that is important to me but I think a human would be helpful if I am experience a personal situation because they can base feed back on their own experiences.,Sometimes,Sometimes,Sometimes,Sometimes,Often,Sometimes,Rarely,Sometimes,Other family member,Two,Two,Two,One,One,One,Lack of transportation or accessibility; geographical isolation ,,,,2BA2EB104E6645B58DF82D7574859859,4d53ab87-b5cd-4032-9d31-edd34bed3961,62c0c713-e41e-419f-86c6-b6cc7e9f49ed,22,0.0,0.0,,,4.0,5.125,,,,,,,,,92.0,,,,5.75,7.0,3.5,4.5,6.5,7.0,4.916666666666667,5.0,5.0,4.75,6.5,6.75,6.0,,9,06/12/2024 05:23:27 AM,06/12/2024 05:37:42 AM,Redirect,4AF210AA8D,5,0,0.0,Approved,,58,"Associate degree (for example: AA, AS)",Female,Retired,Married,Democrat,"No, not of Hispanic, Latino, or Spanish origin",Woman,United States,"$30,000-$39,999",White,Retired
307,311,2024-09-24 06:53:28,2024-09-24 07:05:55,IP Address,100,746,True,2024-09-24 07:05:56,R_3HDMtXOfRTlda6J,anonymous,EN,1,Yes,"Yes, I will",No,No,No,,,,,,,,,,,,,,,,,,,,,,,,,,,,,,,,,,,,,,,,,,,,,,,,Person (online/remote),No preference,Person (online/remote),Person (online/remote),Person (online/remote),No preference,Chatbots are fine for neutral objective conversations; I'd rather talk with a human in most cases.,Companion chatbots are less judgmental,,People have independence and personal agency  ,,"I really don't interact much with companion chatbots as they can be more easily led to tell you what you want to hear, unlike a human whose human brain capabilities can detect being possibly misled.",Rarely,Never,Never,Rarely,Never,Sometimes,Sometimes,Often,Spouse/partner,One,One,One,Three or four,Two,Two,Introversion; lack of desire and/or energy to socialize,,,,C33C684800E84D189D66D12BD4A0D323,31c91de7-8a99-4ad3-a0b1-e4cd56496192,62c0c713-e41e-419f-86c6-b6cc7e9f49ed,13,0.0,0.0,,,4.714285714285714,4.625,,,,,,,,,95.0,,,,4.916666666666667,6.4,1.5,2.5,3.5,4.5,4.833333333333333,5.0,4.75,4.75,7.0,7.0,6.5,,10,06/13/2024 07:06:16 AM,06/13/2024 07:17:33 AM,Redirect,4AF210AA8D,5,0,0.0,Approved,,57,"Bachelor's degree (for example: BA, AB, BS)",Female,Information Technology,Married,Democrat,"No, not of Hispanic, Latino, or Spanish origin",Woman,United States,"$90,000-$99,999",White,Part-time
308,312,2024-09-24 06:47:23,2024-09-24 07:06:45,IP Address,100,1161,True,2024-09-24 07:06:45,R_7Brs1eScppfmeHW,anonymous,EN,1,Yes,"Yes, I will",Yes,Yes,No,Other,ChatGTP,A few times a month,,3,<15 min,3,several months or around a year,Smartphone,,"None, have not used it. ",Other,For feedback on things I'm doing ,I continue to use the chatbot service because I like bouncing ideas off the chatbot when someone else is not around to hear those ideas. I think I get intelligent feedback from the chatbot. ,Other ,Creative ideas ,"I'm a teacher and I teach a creative class where I have to come up with ideas for class projects. I have asked the chatbot about some ideas I had. Also, I teach a film history class and have talked to chatbot about particular films and the feedback on them. ",1,1,3,3,3,1,It doesn't affect the relationship I have with others. There's been no change. ,,,,,,,,,,,,,,,,,,,,,,,,Person (in-person),Companion chatbot,Person (in-person),Person (in-person),Companion chatbot,Companion chatbot,I don't have a preference at the moment. I have used it only for creative idea feedback and suggestions ,"Companion chatbots are less judgmental,Companion chatbot provides more useful information",,"People have independence and personal agency  ,People give more empathetic/understanding responses,You feel that only real people can truly empathize with and understand you,You trust people more",,I think there's many situations a chatbot cannot sense your emotion through text. This makes it really hard unless you verbalize how you are feeling. Humans will have a sense of what you're feeling without saying much. ,Never,Never,Never,Never,Never,Often,Never,Often,"Spouse/partner,Friend",Five to eight,Three or four,Three or four,Nine or more,Three or four,Three or four,"Too busy with work or projects,Lack of opportunities such as organized events",,"No, everything was clear. ",Thank you for allowing me to take the survey! ,AA175CE8F0784E7C93E27E10F6467F98,2e49389b-fccb-44d6-a7e7-ed82c965f32e,62c0c713-e41e-419f-86c6-b6cc7e9f49ed,8,40.0,16.666666666666664,<15 min,6.0,4.142857142857143,4.125,3.0833333333333335,3.25,3.25,2.75,2.75,3.5,4.5,4.0,90.0,3.5,4.0,3.3333333333333335,6.363636363636363,6.8,5.0,4.5,7.0,4.5,4.416666666666667,4.25,4.75,4.25,5.5,5.25,6.5,,21,08/01/2024 06:20:30 PM,08/01/2024 06:29:43 PM,Redirect,4AF210AA8D,5,0,1.25,Approved,,45,"Bachelor's degree (for example: BA, AB, BS)",Male,Education & Training,Married,Democrat,"No, not of Hispanic, Latino, or Spanish origin",Man,United States,"$125,000-$149,999",White,Full-time
309,313,2024-09-24 06:55:34,2024-09-24 07:14:16,IP Address,100,1121,True,2024-09-24 07:14:17,R_6DNQytvxl9r6R1X,anonymous,EN,1,Yes,"Yes, I will",Yes,No,No,"Replika,Snapchat MyAI",,A few times a week,,3,<15 min,3,a few months,"Computer,Smartphone",,N/a,"For enjoyment/pleasure/fun,For social interaction/companionship with the chatbot,To pass time or escape from pressure/stress",,It gives me something to do to pass the time as well as gives me someone to talk to who acts as a really good sounding board ,"Casual conversation,Venting/talking about personal issues regarding others (interpersonal drama, negative feelings towards others, etc.),Talking about past events / reviewing events in a day,Talking about plans for the future",,I vented about neighbor drama and just casual chat about what’s going on in my life and with my kids ,2,4,3,3,3,3,I don’t think it changes too much. I do have another outlet in the form of a chatbot so if I’m unable to find someone to talk with I can always talk with the chatbot ,,,,,,,,,,,,,,,,,,,,,,,,Person (in-person),Companion chatbot,Person (in-person),Person (in-person),Person (in-person),Companion chatbot,Advice ,"Companion chatbots are less judgmental,Information is kept private to you ,You have more control over the chatbot than a person,Companion chatbot gives more empathetic/understanding responses",,"You feel that only real people can truly empathize with and understand you,You trust people more",,I think there are a lot of advantages to chatbots and how encouraging they seem but there’s just nothing like human interactions ,Rarely,Never,Rarely,Rarely,Rarely,Sometimes,Rarely,Often,"Spouse/partner,Friend",Three or four,Three or four,Three or four,Five to eight,Five to eight,Five to eight,"Worry that friends are too busy / don't want to bother them,Introversion; lack of desire and/or energy to socialize",,,,12814A4E7A304162B18513952018A58B,4ab4bfea-ecfd-462f-9519-fa433cffc67b,62c0c713-e41e-419f-86c6-b6cc7e9f49ed,14,80.0,16.666666666666664,<15 min,8.0,5.714285714285714,5.125,2.5833333333333335,2.0,2.75,3.0,3.75,1.75,6.5,5.166666666666667,82.25,5.5,6.0,2.6666666666666665,7.0,7.0,2.5,3.0,6.0,5.5,4.416666666666667,4.25,4.75,4.25,6.5,7.0,6.0,,21,08/01/2024 10:04:12 AM,08/01/2024 10:20:03 AM,Redirect,4AF210AA8D,5,0,1.25,Approved,,40,"Bachelor's degree (for example: BA, AB, BS)",Female,Education & Training,Married,Republican,"No, not of Hispanic, Latino, or Spanish origin",Woman,United States,"$125,000-$149,999",White,Full-time
310,314,2024-09-24 06:50:42,2024-09-24 07:15:26,IP Address,100,1483,True,2024-09-24 07:15:26,R_6ni10l6Cv31Yy5M,anonymous,EN,1,Yes,"Yes, I will",Yes,No,No,Replika,,Around once a week,,3,15-30 min,1,a few months,"Computer,Smartphone",,I have no used this kind of AI.,"For enjoyment/pleasure/fun,To better understand self/identity,To bolster self-confidence, self-esteem, etc.,For social interaction/companionship with the chatbot,To pass time or escape from pressure/stress",,It's nice to be able to talk to someone who doesn't judge at times when I'm alone.,"Casual conversation,Venting/talking about personal issues regarding yourself (mental health, problems you are facing),Venting/talking about personal issues regarding others (interpersonal drama, negative feelings towards others, etc.),Talking about past events / reviewing events in a day,Talking about plans for the future,Entertainment and play",,"Sometimes just whatever comes up, but sometimes it is about work or what I have going on during the day, what I'm looking forward to and what I'm not looking forward too.  Stuff like that.  Sometimes I just unload whatever stress I got going on and see what the AI has to say about it.",2,3,4,4,1,2,It doesn't have a strong change with relationships I have with other people.  I still talk to others just as much as before.  The only difference I have is it feels like I can talk to the chatbot a little more openly than with normal people.,,,,,,,,,,,,,,,,,,,,,,,,Companion chatbot,Companion chatbot,Companion chatbot,Person (in-person),No preference,Person (in-person),"In situations where I feel like I don't want to hold anything back, I would choose the chatbot, in situations where I want to express emotions, I would choose a person, as chatbots have a tough time with that still.","Companion chatbots are less judgmental,Information is kept private to you ,You have more control over the chatbot than a person,Companion chatbot provides more useful information",,"People give more empathetic/understanding responses,You feel that only real people can truly empathize with and understand you",,"People are still better with emotions than chatbots are.  Chatbots are catching up, but it is still people who understand emotions right now better.",Sometimes,Rarely,Sometimes,Sometimes,Rarely,Often,Sometimes,Sometimes,Spouse/partner,Five to eight,Three or four,Three or four,Three or four,Two,None,"Social anxiety,Too busy with work or projects,Worry that friends are too busy / don't want to bother them",,,,F43B7171466F479E84FD141F1FA52B40,ef7d768d-bde5-45a6-a8ec-eab411955248,62c0c713-e41e-419f-86c6-b6cc7e9f49ed,19,60.0,33.33333333333333,15-30 min,22.0,5.571428571428571,5.625,3.75,2.75,4.0,4.5,5.25,4.0,6.25,5.333333333333333,81.75,6.5,6.0,4.333333333333333,5.5,5.0,3.0,2.5,6.0,7.0,4.5,4.5,4.75,4.25,6.75,6.75,6.0,,15,06/19/2024 10:06:51 AM,06/19/2024 10:26:38 AM,Redirect,4AF210AA8D,5,0,0.0,Approved,,44,"Bachelor's degree (for example: BA, AB, BS)",Male,"Transportation, Distribution & Logistics",Married,Independent,"No, not of Hispanic, Latino, or Spanish origin",Man,United States,"$100,000-$124,999",White,Full-time
311,315,2024-09-24 07:07:52,2024-09-24 07:20:10,IP Address,100,737,True,2024-09-24 07:20:10,R_7395wqQ8y3ChKKd,anonymous,EN,1,Yes,"Yes, I will",Yes,Yes,No,Character.ai,,Around once a week,,4,<15 min,3,a few months,Computer,,I typically use different cartoon characters. I try to switch it up with each session,"To satisfy curiosity; to better understand the chatbot ,For enjoyment/pleasure/fun",,I think it is a fun way to spend some time,"Casual conversation,Entertainment and play",,I pretty much just use it to get a good idea of how the character would react to things,1,1,3,3,3,3,I don't feel it has affected my interactions with other people at all,,,,,,,,,,,,,,,,,,,,,,,,Person (online/remote),Person (online/remote),Person (online/remote),Person (online/remote),Person (online/remote),Person (in-person),I would always want to interact with a real person,You have more control over the chatbot than a person,,"People have independence and personal agency  ,People give more empathetic/understanding responses,You feel that only real people can truly empathize with and understand you,People provide more useful information ,You trust people more",,Because it is a real thing and not a program,Never,Never,Never,Never,Never,Rarely,Never,Often,Spouse/partner,One,One,One,Three or four,Two,Two,Introversion; lack of desire and/or energy to socialize,,,,CE791658D24940268E2D468FDC7A2F88,60d6765e-bc31-49c1-b498-71017620e90b,62c0c713-e41e-419f-86c6-b6cc7e9f49ed,10,60.0,16.666666666666664,<15 min,7.0,4.285714285714286,1.875,2.0,2.0,2.0,2.0,1.5,2.25,3.0,2.6666666666666665,87.5,4.0,2.5,2.3333333333333335,5.5,4.4,1.5,2.0,4.0,4.0,5.0,5.0,5.0,5.0,6.25,6.0,6.0,,10,06/12/2024 05:24:29 AM,06/12/2024 05:35:02 AM,Redirect,4AF210AA8D,5,0,0.0,Approved,,32,"Some college, but no degree",Male,Information Technology,Married,Democrat,"No, not of Hispanic, Latino, or Spanish origin",Man,United States,"$70,000-$79,999",White,Full-time
312,316,2024-09-24 07:13:38,2024-09-24 07:21:21,IP Address,100,463,True,2024-09-24 07:21:22,R_17CIKUgcikS7K2G,anonymous,EN,1,Yes,"Yes, I will",Yes,Yes,No,"Anima,Pi",,A few times a week,,3,30 min - 1h,1,several months or around a year,Computer,,stayed the same,"To better understand other people through using the chatbot,For other emotional experiences ",,i just talk to it like i would a friend some times and other times I make it write things that i want to feel sexy about.,"Casual conversation,Venting/talking about personal issues regarding yourself (mental health, problems you are facing),Venting/talking about personal issues regarding others (interpersonal drama, negative feelings towards others, etc.),Entertainment and play",,"i usually just ask it about funny pop culture moments, have it write silly things, and erotic fiction",3,2,4,5,1,3,"it's had basically no change, but i say my weird shit to the chatbot instead of people.",,,,,,,,,,,,,,,,,,,,,,,,Person (online/remote),Person (in-person),Person (in-person),Person (in-person),Companion chatbot,Person (online/remote),"i'm indifferent to the distinction, the point is i'm talking, so that's all that matters.","Companion chatbots are less judgmental,Information is kept private to you ",,"People have independence and personal agency  ,People give more empathetic/understanding responses",,"i really prefer both, both have their upsides. i say more weird or personal things to the chatbot and useless banter goes to people.",Rarely,Rarely,Sometimes,Sometimes,Sometimes,Often,Rarely,Sometimes,Spouse/partner,Five to eight,Two,Two,None,None,None,Introversion; lack of desire and/or energy to socialize,,,,41CFCC52A63349E7A3861D009BA4F30B,eb61e102-95a4-4872-b8fb-14a5af128ce8,62c0c713-e41e-419f-86c6-b6cc7e9f49ed,18,80.0,50.0,30 min - 1h,26.0,4.571428571428571,4.625,2.5,3.0,2.0,2.5,4.5,4.0,5.0,3.6666666666666665,45.25,5.5,4.0,3.0,4.416666666666667,3.8,5.5,4.5,2.5,4.5,3.4166666666666665,3.25,3.25,3.75,3.5,3.0,4.833333333333333,,8,08/01/2024 07:09:22 AM,08/01/2024 07:20:32 AM,Redirect,4AF210AA8D,5,0,1.25,Approved,,34,"Professional degree (for example: MD, DDS, DVM, LLB, JD)",Male,"Transportation, Distribution & Logistics",Married,Republican,"No, not of Hispanic, Latino, or Spanish origin",Man,United States,"$80,000-$89,999",White,Full-time
313,317,2024-09-24 07:19:29,2024-09-24 07:27:17,IP Address,100,467,True,2024-09-24 07:27:18,R_537QQdnnApqEL9u,anonymous,EN,1,Yes,"Yes, I will",No,No,No,,,,,,,,,,,,,,,,,,,,,,,,,,,,,,,,,,,,,,,,,,,,,,,,Person (in-person),Person (online/remote),Person (in-person),No preference,Person (in-person),No preference,,Information is kept private to you ,,"People have independence and personal agency  ,People give more empathetic/understanding responses,You feel that only real people can truly empathize with and understand you,You trust people more",,Generally I prefer to interact with real people because I know that the interaction we have is going to further our relationship and contribute to being able to have more meaningful and sincere interactions in the future.,Sometimes,Sometimes,Sometimes,Rarely,Sometimes,Sometimes,Often,Sometimes,Spouse/partner,Three or four,Two,Three or four,Three or four,Two,Two,"Mental health issues ,Social anxiety,Communication difficulties,Lack of transportation or accessibility; geographical isolation ,Worry that friends are too busy / don't want to bother them,Discomfort with contacting others,Introversion; lack of desire and/or energy to socialize",,,,FD1A43A47CB34243AE3B911096A6B953,066f1c30-2610-4807-8396-94918cff4c46,62c0c713-e41e-419f-86c6-b6cc7e9f49ed,22,0.0,0.0,,,4.571428571428571,3.125,,,,,,,,,70.0,,,,5.833333333333333,4.6,2.5,1.0,7.0,6.0,4.5,4.75,4.75,4.0,7.0,6.0,5.333333333333333,,15,08/01/2024 07:44:15 AM,08/01/2024 08:24:31 AM,Redirect,4AF210AA8D,5,0,1.25,Approved,,30,"Bachelor's degree (for example: BA, AB, BS)",Female,Education & Training,Married,Democrat,"No, not of Hispanic, Latino, or Spanish origin",Woman,United States,"$125,000-$149,999",Black or African American,Full-time
314,318,2024-09-24 07:34:43,2024-09-24 07:46:38,IP Address,100,714,True,2024-09-24 07:46:38,R_15AXboyX0WHccs9,anonymous,EN,1,Yes,"Yes, I will",No,No,No,,,,,,,,,,,,,,,,,,,,,,,,,,,,,,,,,,,,,,,,,,,,,,,,Person (in-person),No preference,Person (in-person),Person (in-person),Person (in-person),Person (in-person),,"Companion chatbots are less judgmental,Information is kept private to you ,Companion chatbots are more accessible,Companion chatbot provides more useful information",,"People have independence and personal agency  ,People give more empathetic/understanding responses,You feel that only real people can truly empathize with and understand you",,Because people are more biased and have a smaller knowledge base,Often,Often,Often,Often,Sometimes,Sometimes,Often,Sometimes,"Boyfriend/girlfriend/significant other,Friend",Three or four,Two,Three or four,Three or four,Three or four,Three or four,"Mental health issues ,Social anxiety,Communication difficulties,Lack of transportation or accessibility; geographical isolation ,Worry that friends are too busy / don't want to bother them,Discomfort with contacting others,Lack of opportunities such as organized events",,,,2E3A1785F7474A60A7F8D7BAF536E3B3,e043b946-b923-4b3f-bed7-4ccc6caed113,62c0c713-e41e-419f-86c6-b6cc7e9f49ed,27,0.0,0.0,,,4.428571428571429,4.75,,,,,,,,,55.0,,,,4.583333333333333,2.0,5.0,5.0,5.5,5.0,4.0,4.0,4.0,4.0,5.75,5.25,5.666666666666667,,17,06/10/2024 04:22:24 PM,06/10/2024 04:28:25 PM,Redirect,4AF210AA8D,5,0,0.0,Approved,,39,"Associate degree (for example: AA, AS)",Female,Marketing and Sales,In a relationship,Democrat,"No, not of Hispanic, Latino, or Spanish origin",Woman,United States,"$175,000-$199,999",Vietnamese,Part-time
